{
  "version": "1",
  "changeMode": "marked",
  "endpoints": [
    {
      "id": "ep1",
      "method": "POST",
      "path": "/users/{user-id}?verbose=true",
      "request": {
        "body": {
          "kind": "type",
          "type": {
            "kind": "ref",
            "ref": "CreateUserRequest",
            "refId": "model.user.create"
          },
          "diff": {
            "before": {
              "type": {
                "ref": "CreatePersonRequest"
              }
            }
          }
        }
      },
      "responses": [
        {
          "status": 200,
          "body": {
            "kind": "type",
            "type": {
              "kind": "ref",
              "ref": "CreateUserResponse",
              "refId": "model.user.response"
            },
            "diff": {
              "before": {
                "type": {
                  "ref": "CreatePersonResponse"
                }
              }
            }
          }
        },
        {
          "status": 400,
          "description": "Validation error.",
          "body": {
            "kind": "none"
          }
        }
      ]
    }
  ],
  "models": [
    {
      "id": "model.user.create",
      "name": "CreateUserRequest",
      "fields": []
    },
    {
      "id": "model.user.response",
      "name": "CreateUserResponse",
      "fields": []
    }
  ],
  "enums": [],
  "sharedNotes": []
}
