{
  "version": "1",
  "changeMode": "marked",
  "title": "API",
  "endpoints": [],
  "models": [
    {
      "id": "model.news.edit",
      "name": "NewsEditView",
      "change": "added",
      "fields": [
        {
          "name": "id",
          "type": {
            "kind": "primitive",
            "name": "String:uuid"
          }
        }
      ]
    }
  ],
  "enums": [],
  "sharedNotes": []
}
